id,organizer_id,title,subtitle,price,duration,image,image_url,description
1,2,Burgos y las Merindades,Secretos del mundo rural,350,4,trips/burgos_merindades.jpg,,"<p>Una salida descubriendo los secretos del mundo rural. Realizaremos excursiones como la Orbaneja de Castillo, Cañones de Ebro y San Pedro de Tejada.</p><p>El precio incluye visitas al Museo Etnográfico de Montejo de San Miguel y a la fábrica de Morcilla de Burgos.</p><p>El hotel previsto es el hotel El Valles situado en Briviesca, a tan solo 20 minutos del centro de Burgos.</p>"
2,2,Los Arribes del Duero,Escarpados cañones de 200 metros de desnivel,325,4,trips/arribes_duero.jpg,,"<p>Descubre los Arribes del Duero y sus preciosos cañones escarpados. Durante el viaje visitaremos Zamora, Benavente y la Puebla de Sanabria y Toro</p><p>El precio incluye una degustación de vinos de Oporto y una exhibición de aves rapaces. </p><p>El hotel previsto es el Rey Don Sancho, en Zamora y próximo al centro de la ciudad</p>"
3,2,Teruel y Albarracín,Varios de los pueblos más bonitos de España,350,4,trips/teruel_albarracin.jpg,,"<p>Esta vez nos vamos a Teruel. El viaje consta de varias excursiones como Mirambel, Mosquerela y Albarracín. </p><p> El precio incluye una visita a las catedrales de Teruel y Albarracín, y una entrada al Museo Guerra Carlistas de Cantavieja.</p><p>El hotel previsto es el Reina Cristina, situado en el centro de Teruel, el cual ha sido proclamado Patrimonio de la Humanidad por la UNESCO y alberga muchos ejemplos de arquitectura mudéjar</p>"
4,2,Benidorm,Ahora toca disfrutar,420,5,trips/benidorm.jpg,,"<p>Toca comprar bañador porque nos vamos a Benidorm, aunque no todo va a ser playa, ya que conoceremos la ciudad de Benidorm y el Mercado Rincón de Loix. Además el precio incluye la visita a Altea. </p><p>El hotel previsto será el Med Regente situado en la ciudad de Benidorm con una valoración de 4 estrellas.</p>"
5,2,"Galicia, Rías Baixas",Especial Año Xacobeo,570,6,trips/galicia_baixas.jpg,,"<p> Celebrando el especial del año Xacobeo hacemos las maletas para Galicia. Realizaremos excursiones a Sanxenxo, Cambados y Orense con un guía local.</p><p>El precio incluye un paseo en barco por la Ría Arousa con degustación.</p><p>El hotel previsto es el Nuevo Astur, situado en el centro de las Rías Baixas con habitaciones modernas y bien equipadas, además incluye una sesión de spa.</p>"
6,2,Asturias,Naturaleza escondida y sus costumbres,500,6,trips/asturias.jpg,,"<p>En esta ocasión proponemos una visita a Asturias y sus preciosas tierras. Realizaremos excursiones como la Senda del Oso y el Museo de la Prehistoria de Teverga.</p><p>El precio incluye entradas para los museos de Ayalgas Silviella y Somiedo.</p><p>El hotel previsto es el Gran Hotel Cela, ubicado en la zona sur del Parque Natural de Somiedo, el cual ofrece unas vistas y un entorno impresionante</p>"
7,2,Euskadi: Mar y Montaña,¡Aupa!,544,6,trips/euskadi.jpg,,"<p>Nos vamos a contemplar la naturaleza de Euskadi. Se realizarán excursiones como Astigarraga, Mondragón y Oñati.</p><p>El precio incluye la visita al Santuario de Estibaliz y la barcaza Portugalete.</p><p>El hotel previsto es el Balneario Areatza, rodeado de jardines y con un buffet variado. Además se incluye el acceso de una hora a su valneario, merece la pena probarlo.</p>"
8,2,Granada,El motivo para perderse,575,6,trips/granada.jpg,,"<p>Una salida para descubrir Granada y sus maravillas. Realizaremos excursiones como la Ruta Alpujarreña, Almuñecar, La Alhambra y Guadix.</p><p>El precio incluye entradas para la Iglesia de las Angustias, el museo arqueológico de Almuñecar y un taller de jarapas.</p><p>El hotel previsto es el Urban Dream, a 10 minutos a pie de la catedral de Granada y del centro de la ciudad.</p>"
9,2,Portugal Monumental,"Castillos, Abadías y Palacios de Portugal",429,6,trips/portugal.jpg,,"<p>El viaje de hoy es Portugal y su arquitectura. Se realizarán excursiones a Lisboa, Estoril y Cascais. </p><p>El precio incluye una entrada al monasterio Nossa Senhora de Vitóri, un paseo por las Grutas de Mira do Aire y la visita del Castillo de Almourol.</p><p>EL hotel previsto es el Hotel Recinto, un pequeño hotel situado en una zona privilegiada de Fátima, a solo 50 metros del famoso santuario de la basílica de Nuestra Señora del Rosario.</p>"
10,2,Tenerife,A la sombra del Teide,670,6,trips/tenerife.jpg,,"<p>Nos vamos a Tenerife, así que id preparando vuestra ropa veraniega. Realizaremos excursiones como el Parque Nacional del Teide con un guía local.</p><p>El precio incluye las visitas a Villa de Candelaria y Garachico.</p><p>El hotel previsto es el Catalonia Las Vegas, situado frente a los lagos Martiánez y cuenta con unas vistas asombrosas a la montaña del Teide. </p>"
11,2,Gran Canaria,Isla para soñar sin cerrar los ojos,665,6,trips/gran_canaria.jpg,,"<p>En esta ocasión Gran Canaria es nuestro destino. El viaje cuenta con excursiones a las Cumbres Canarias y a los Barrancos del Sur. </p><p>El precio incluye una entrada a la casa Cueva de Guayadeque.</p><p>El hotel previsto es el Green Field, un complejo moderno situado a 5 minutos de la playa del Inglés. Además, cuenta con una gran piscina al aire libre con tumbones para disfrutar las maravillosas vistas que Gran Canaria ofrece. </p>"
12,2,Berlín,La ciudad que cambió el mundo,934,5,trips/berlin.jpg,,"<p>Inauguramos nuestra sección de salidas europeas con la ciudad de Berlín. Realizaremos visitas  a Dresde y Barrio Judío con guía local.</p><p>El precio incluye  una entrada al Museo Pérgamo y a Postdam.</p><p>El hotel previsto es el Grand City East, el cual cuenta con una valoración de 4 estrellas.</p>"
13,2,Praga,Ciudad de cuentos y leyendas,940,5,trips/praga.jpg,,"<p>Próxima parada Praga, abróchense los cinturones. Realizaremos  excursiones de día completo como la panorámica de Praga. </p><p>El precio incluye un paseo por Praga Iluminada y una pequeña travesía en barco por río Moldava. </p><p>El hotel previsto  es el Duo, el cual alberga un restaurante de estilo rústico y su estación de metro está situada a 10 minutos del centro de la ciudad. </p>"
14,2,Roma,La ciudad eterna,955,5,trips/roma.jpg,,"<p>Nos vamos a visitar la ciudad italiana de Roma. El viaje cuenta con excursiones como la Plaza de España, Roma Cristiana y la escalinata Trinita dei Monti.</p><p>El precio incluye una entrada a las catacumbas y un paseo por la Roma Barroca. </p><p>El hotel previsto es el Fleming, a 10 minutos en coche del estadio olímpico de Auditorium y del foro itálico. </p>"
15,2,Madeira,El paraíso de las flores,1224,8,trips/madeira.jpg,,"<p>Inauguramos nuestra sección de salidas de media distancia con Madeira. Realizaremos excursiones de día completo como la del Cabo Girao y Encumeda. </p><p>El precio incluye las visitas a Funchal y al mirador de Pico dos Barcelos. Otras visitas opcionales son el Jardín Tropical y una cena típica Madeirense.</p><p>El hotel previsto es el Jardins da Ajuda, un complejo que ofrece excelentes piscinas cubiertas y al aire libre con maravillosas vistas. </p>"
16,2,Londres y París,Distinas pero imprescindibles,1495,8,trips/londres_paris.jpg,,"<p>Siguientes paradas europeas son la de Londres y París, dos de las ciudades más preciosas que Europa ofrece. Se realizarán excursiones en ambas ciudades con guía local y pudiendo entrar en las distintas zonas comerciales que ofrecen. </p><p>El precio incluye la entrada al museo Británico y al museo del Perfume, aunque también dispondremos de excursiones opcionales para aquellos interesados como el Castillo Windsor y el Palacio de Versalles. </p><p> Los hoteles contemplados son el Jurys Inn Croydon de Londres y el Hill Paris Meudon.</p>"
17,2,Tirol y Baviera,Mucho más que chocolate y relojes de cuco,1165,8,trips/tirol_baviera.jpeg,,"<p>Una salida para descubrir la naturaleza y paisajes de Tirol. Realizaremos excursiones como la de Salzburgo y una visita al Lago Achensee. </p><p>El precio incluye una entrada a la Fábrica Swarovski y al palacio de Hogburg. </p><p>El hotel previsto es el Krone Oberperfuss, con una valoración de 3 estrellas y unos días después nos alojaremos en el Austria Trend Mitte para visitar Salzburgo.</p>"
18,2,Joyas de Polonia,Vive un gran cuento,1349,8,trips/polonia.jpg,,"<p>Próxima parada Polonia, una de las ciudades más preciosas de Europa. Realizaremos excursiones a Poznan y Auschwitz con guía local. </p><p>El precio incluye una entrada al campo de concentración de Auschwitz y una visita a la mina de sal de Wieliczka. </p><p>El hotel previsto es el Ibis Centrum, situado en la ciudad de Poznan.</p>"
19,2,Transilvania y Rumanía,El jardín de los cárpatos,1145,8,trips/transilvania.jpg,,"<p>Nuestro próximo viaje es descubrir la preciosa Rumanía, concretamente las leyendas de Transilvania. Realizaremos excursiones a Sinaia y Sibiu con guía local. </p><p>El precio incluye la entrada al palacio de Peles y al castillo de Bran.</p><p>El hotel previsto es el Ibis Styles Bucharest Center, situado en la ciudad de Bucarest con una valoración de 4 estrellas.</p>"
20,2,Marruecos al completo,Un mundo de sensaciones,1070,8,trips/marruecos.jpg,,"<p>El viaje de hoy es Marruecos, descubriendo nuevas culturas y sensaciones. Realizaremos excursiones a Rabat y Marrakech con guía local.</p><p>El precio incluye  una entrada al Kasbash de Ait Benhaddou y al Palacio de la Bahía. </p><p>El hotel previsto es el Hotel Ayoub, situado en Marrakech, y con una valoración de 4 estrellas.</p>"
21,2,Lo mejor de Túnez,Paisajes del desierto,1026,8,trips/tunez.jpg,,"<p>Nos vamos a Túnez y sus asombrosos desiertos. Realizaremos excursiones de día completo como Sousse, Sfax y Sidi Bou Said. </p><p>El precio incluye una entrada al Anfiteatro Romano de El Jem y a la gran Mezquita de Kairouan. </p><p>Los hoteles previstos son el Golden Tulip Taj Sulta situado en Hammamet, y el Hotel Movenpick en Sfax, ambos de 5 estrellas de valoración.</p>"
22,2,Egipto,Cuna de faraones,1440,8,trips/egipto.jpg,,"<p>Próxima parada Egipto, una de las maravillas del desierto. Realizaremos excursiones a los Templos de Karnak y Luxor, y al recinto de las pirámides de Memphis. </p><p>El precio incluye una entrada al Templo de Edfu y a la pirámide de Kefren. </p><p>El hotel previsto es el Barceló Cairo situado en la propia ciudad de El Cairo, con 4 estrellas de valoración </p>"
23,2,Georgia y Armenia,Viaje a los confines de Europa,1675,9,trips/georgia.jpeg,,"<p>Inauguramos nuestra sección de salidas de larga distancia con Georgia y Armenia. Realizaremos excursiones como Mtsjeta, Gori y Uplistsije con guía local. </p><p>El precio incluye la entrada al Museo de Echmiadzin y a una bodega de vinos de degustación. </p><p>El hotel previsto es el Gold Tbilisi situado en la propia Tiblisi, que cuenta con 4 estrellas de valoración. </p>"
24,2,Uzbekistán,La ruta de la seda,1700,9,trips/uzbekistan.jpg,,"<p>Nuestro primer paso por las tierras Asiáticas, Uzbekistán. Realizaremos excursiones a Tashkent y Khiva con guía local. </p><p>El precio incluye una cena con Folklore Show y la visita al Palacio de Invierno de Bukhara. </p><p>El hotel previsto es el Krokus Plaza, situado en Tashkent, y el hotel  Rangrez (no dispone de acensor), en la ciudad de Buhkara, con una valoración de 3 estrellas. </p>"
25,2,Tierra Santa,Lugar sagrado,1710,8,trips/tierra_santa.jpg,,"<p>En visita de las buenas valoraciones a nuestros viajes africanos, traemos una escapada a la Tierra Santa en Israel. Realizaremos excursiones como la del Monte de las Bienaventuranzas y Jerusalén, con guía local. </p><p>El precio incluye una entrada a las ruinas de Cafarnaúm y a la gruta de los Jerónimos. </p><p>Los hoteles previstos son el Margoa Netanya situado en la periferia de Tel Aviv, y el Jerusalem Gate, en la propia ciudad de Jerusalén.</p>"
26,2,Nueva York,La gran manzana,2215,8,trips/nueva_york.jpeg,,"<p>Próxima parada la gran ciudad de Nueva York y nuestro primer paso por América. Realizaremos excursiones como la visita a Manhattan y el Tour de Compras. </p><p>El precio incluye una visita en barco a la Estatua de la Libertad y al Empire State Building. </p><p>El hotel previsto es el Hilton Garden Inn Secaucus, ubicado en el propio Secaucus, a 12km de Manhattan.</p>"
27,2,Encantos de Canadá,Naturaleza salvaje,1990,8,trips/canada.jpg,,"<p>Nuestro próximo destino son los paisajes de Canadá. Realizaremos algunas excursiones como Toronto y Ottawa con guía local. </p><p>El precio incluye una escapada a las Cataratas del Niágara y un paseo en barco por Mil Islas. </p><p> El hotel previsto es el Days Inn Otawa West, situado en la periferia de Ottawa con una valoración de 3 estrellas. </p>"
28,2,Costa Rica,Descubre la pura vida,1810,9,trips/costa_rica.jpg,,"<p>Inauguramos nuestra sección sudaméricana con Costa Rica. Realizaremos excursiones como San José y el Parque Nacional Manuel Antonio con guía local. </p><p>El precio incluye una entrada a la plantación de Piña y una visita a la reserva biológica de Monteverde. </p><p>El hotel previsto es el Hotel Los Cipreses, situado en la periferia de Monteverde, con una valoración de 3 estrellas. </p>"
29,2,Panamá fascinante,Déjate impresionar por su gran canal,1830,8,trips/panama.jpg,,"<p>Nos vamos a contemplar la fascinante y marítima Panamá. Realizaremos excursiones de día completo como la Comunidad Emberá y Esclusas de Miraflores. </p><p>El precio incluye una caminata por el sendero en Gamboa y una visita al Casco antiguo de Panamá. </p><p> El hotel previsto el Crowne Plaza Panamá City, situado en la propia ciudad de Panamá, con una valoración de 4 estrellas. </p>"
30,2,Cuba,Recuerdos del Che Guevara,1530,9,trips/cuba.jpg,,"<p>Próxima parada por sudamérica y es en la fantástica Cuba. Se realizarán excursiones como Orquideario de Soroa y un paseo en bote por la cueva del Indio. </p><p>El precio incluye las visitas a la Habana y al Valle de los Ingenieros. </p><p>El hotel previsto es el Memories Trinidad del Mar (no dispone de ascensor), en la propia ciudad de Trinidad, con una valoración de 4 estrellas. </p>"
31,2,Crucero fluvial Rhin,El crucero de rincones con encanto,1374,8,trips/crucero_rhin.jpg,,"<p>Inauguramos nuestra sección de cruceros con el fluvial Rhin. El crucero partirá desde Ámsterdan a Zúrich. </p><p>El precio incluye las visitas de Ámsterdan, Heidelberg y Estrasburgo con gabinete musical. </p><p> El buque previsto es el MS Amadeus Silver 3, barco de vanguardia para 168 pasajeros. Todas sus cabinas son exteriores y cuentan con una elegante y moderna decoración. </p>"
32,3,Islas Griegas y Malta,Crucero por la costa pacífica,1049,8,trips/islas_griegas.jpg,,"<p>Nuestro primer crucero es por las Islas Griegas saliendo desde Bari, para acabar volviendo a esta una vez finalizado el trayecto. </p><p> El precio incluye las visitas de la Catania de Bellini, Mikonos y un paseo por Bari en trenecito. </p><p>El buque previsto es el Costa Pacífica con una valoración de 4 estrellas por parte de los usuarios. Los camarotes son dobles aunque existe la posibilidad de tener un camarote con balcón a través de un suplemento de cabina de 150€ por persona. </p>"
33,3,"Italia, Grecia y Venecia",La ruta de la armonía,999,8,trips/crucero_italia.jpg,,"<p>En vista del éxito de nuestro primer crucero, ofrecemos un trayecto por Italia, Grecia y Croacia, partiendo desde Venecia. </p><p>El precio incluye las visitas de Ostuni y Molino en Brindisi y el barrio de Plaka en Atenas con guía local. </p><p>El buque previsto es el MSC Armonia, con una valoración de 4 estrellas de los usuarios. Al igual que en el anterior viaje, nuestra política ofrece camarones dobles, aunque existe la posibilidad de utilizar un suplemento de cabina de 150€ que incluye balcón y bebidas por persona. </p>"
34,3,Camino de Santiago,Y que esto no pare,390,6,trips/camino_santiago.jpg,,"<p>Inauguramos nuestra sección de excursiones y no podía ser otra que el Camino de Santiago. </p><p>Se realizarán visitas a Lugo y Santiago de Compostela con guía local. Además podremos ver la cascada de Ézaro. </p><p>El precio incluye un autocar para traslados y excursiones según el itinerario previsto, además de un régimen de pensión completa, además de un seguro básico de viaje.</p>"
35,21,Mi viaje a París,Paraiso infantil,750,5,,https://media.disneylandparis.com/d4th/es-es/images/n037009_2029mar16_world_30-anniversary-fireworks-castle_16-9_tcm797-233244.jpg?w=1960,"<p> Este es el primer viaje que cuento por aquí, así que espero que os guste. Voy a contaros mi experiencia en mi visita a la ciudad de París.</p><p>Fui a París con mis padres cuando era pequeño, es una experiencia que nunca olvidaré y que yo creo que toda familia debe realizar, en especial por los niños, es uno de los viajes que todos soñamos desde pequeños.</p><p>Entrando ya más en detalle, tengo el recuerdo de la ciudad de París como imágenes rápidas pero increíbles como la catedral de Notre Dame o la Torre Eiffel, esto al fin y al cabo son algunas de las visitas obligadas de esta ciudad y mi familia aprovechó para hacerlas. Pero sin ninguna duda lo mejor fue Disneyland.</p><p>Qué decir de Disneyland, este paraíso donde conoces a tus personajes favoritos y puedes hacerte fotos con ellos, es sin duda mi mejor recuerdo de París, esa famosa foto que todos queríamos hacernos con el pato Donald.</p><p>Sin enrollarme mucho más considero que es una viaje muy recomendado y espero poder repetirlo en un futuro y esta vez sí admirar la ciudad y no solo Disneyland.</p>"
36,22,Dhawa Yura Kioto,Banyan Tree Group,1389,5,,https://cf.bstatic.com/xdata/images/hotel/max1024x768/198368975.jpg?k=d4630cbdf706d01c4057287155dfb0549d88f5e4b0b06d435e06c9b855ea3f2b&o=&hp=1,"<p>El Dhawa Yura Kyoto - Banyan Tree Group se encuentra en Kioto y ofrece restaurante, bicicletas de uso gratuito, centro de fitness y bar. Hay servicio de conserjería, consigna de equipaje y WiFi gratuita en todas las instalaciones. Hay recepción 24 horas, servicio de habitaciones y cambio de divisa.</p><p>Todas las habitaciones están equipadas con aire acondicionado, nevera, minibar, hervidor de agua, bidet, zapatillas y armario. Las habitaciones incluyen ropa de cama y toallas.
El Dhawa Yura Kyoto - Banyan Tree Group sirve un desayuno americano o asiático.</p><p>En las inmediaciones hay varios lugares de interés, como el Samurai Kembu Kyoto, la estación de Gion Shijo y el templo Shoren-in. El aeropuerto más cercano es el de Itami, ubicado a 50 km del Dhawa Yura Kyoto - Banyan Tree Group. </p>"
37,22,Comfort Hotel Toji,Alójate en el corazón de Kioto,220,5,,https://cf.bstatic.com/xdata/images/hotel/max1024x768/296192459.jpg?k=65ef4c5a80b45531d3883adc1c4f6ce6644d682673295d9f2818ed67dbc1ce0c&o=&hp=1,"<p>El Comfort Hotel Kyoto Toji ofrece habitaciones en Kioto, a 1,3 km del TKP Garden City Kyoto y a 2,1 km del templo Tofuku-ji. El establecimiento está a unos 2,2 km del templo Sanjusangen-do, a 2,3 km del santuario Fushimi Inari Taisha y a 3,7 km del templo Kiyomizu-dera. El castillo de Nijo está a 4,1 km.</p><p>Las habitaciones del hotel disponen de baño privado.</p><p>El Comfort Hotel Kyoto Toji se encuentra a 3,8 km de la villa imperial Katsura y a 3,9 km del Museo Internacional del Manga de Kioto. El aeropuerto más cercano es el de Itami, ubicado a 36 km. </p>"
38,22,Premier Hotel-Sapporo,"La ciudad helada, Hokkaido",484,5,,https://cf.bstatic.com/xdata/images/hotel/max1024x768/411616862.jpg?k=9d424952dba2b94771877a5c0b4e16e20a216238169cf1b63d60be1ef345ea14&o=&hp=1,"<p>El Premier Hotel Tsubaki Sapporo está situado a orillas del río Toyo-Hiragawa, a 9 minutos a pie de la estación de metro de Kikusui. El hotel cuenta con 5 sitios para comer, conserje, peluquería y servicio de alquiler de bicicletas. Las habitaciones incluyen conexión a internet por cable gratuita.</p><p>El Premier Hotel Tsubaki Sapporo está situado a orillas del río Toyo-Hiragawa, a 9 minutos a pie de la estación de metro de Kikusui. El hotel cuenta con 5 sitios para comer, conserje, peluquería y servicio de alquiler de bicicletas. Las habitaciones incluyen conexión a internet por cable gratuita.</p><p>El Premier Hotel Tsubaki Sapporo se encuentra a 45 minutos en coche del nuevo aeropuerto de Chitose o a entre 60 y 70 minutos en el autobús público que para frente al hotel. </p>"
39,21,Ruta del Arco Iris,Descubre Sudáfrica en coche,1374,12,,https://cdn.logitravel.com/wsimgresize/resize/crop/390/217/cdn.logitravel.com/cloudcontent/fotos/tours/maps/34377/1200x600.jpg?B2AC0A47771F93879A02F88896FC5DC3&jpegQuality=97,"<p>Descubre las grandes urbes y la parte noreste de Sudáfrica, con el magnífico Parque Kruger, la cultura zulú y el Estado de Swazilandia.</p><p>En la parte sur del continente africano emerge Sudáfrica como república parlamentaria, con una historia marcada por la vergüenza del Apartheid, pero refundada por el reconocido Nelson Mandela. Descubre las enormes Johannesburgo y Ciudad del Cabo, una de sus tres capitales, sede del poder legislativo del país. Recorre parte de la costa sur hasta el Cabo de Buena Esperanza, con sus playas vírgenes y rica fauna marina, y parte de la costa este, desde Durban y el cercano reino zulú hasta la fantástica vida salvaje del Estuario de Santa Lucía, con sus hipopótamos y cocodrilos y su verde riqueza. Sorpréndete con la irrupción de un Estado soberano en medio del país, monarquía absoluta. Y, sobre todo, vive el Parque Nacional de Kruger, con sus increíbles safaris, conduciendo tú mismo entre jirafas, cebras, leones, leopardos, elefantes y rinocerontes. Aquí darás verdadero valor a los amaneceres y entenderás la magia de la Madre Naturaleza, igual que en las cascadas del río Blyde, donde todo es inmensidad. Este viaje de fascinará. Porque África es única.</p>"
40,22,Langjökul,Tour por la cueva del glaciar,139,1,,https://d3hne3c382ip58.cloudfront.net/files/uploads/bookmundi/resized/cmsfeatured/ice-cave-at-the-langjokull-glacier-in-iceland-1500367481-785X440.jpg,"<p>En este tour exploraremos el segundo glaciar más grande de Europa y recorreremos los túneles excavados en el hielo hasta llegar a la cueva Langjökull. ¡Nos sumergiremos a más de 300 metros bajo hielo!</p><p>Nos encontraremos en Húsafell y pondremos rumbo a la cueva y los túneles de hielo de Langjökull. Para atravesar el hielo sin dificultad, nos ataviaremos con un traje protector y subiremos a un camión de nieve, diseñado para conducir por los glaciares.</p><p>Una vez en Langjökull, comenzaremos explorando la superficie de este glaciar, el segundo más grande de Europa. ¿Sabéis cómo se excavó este túnel artificial? Descubriremos la historia de esta impresionante obra de ingeniería a medida que nos adentramos en los túneles de hielo a más de 300 metros de profundidad.</p><p>Mientras recorremos los corredores de Langjökull, admiraremos el hielo azul presente en el suelo, el techo y las paredes. Además, tendremos la oportunidad de ver la capilla de hielo de la cueva, un lugar único en el mundo para darse el sí quiero…</p><p>Regresaremos a la superficie y nos despediremos en Húsafell.</p><p>Por motivos climáticos, la actividad durará de dos a tres horas en verano y de tres a cuatro horas en invierno.</p>"
41,22,Los pandas de Chengdú,Tour privado por Chengdú,195,2,,https://cdn2.civitatis.com/china/chengdu/galeria/panda-reserva-chengdu.jpg,"<p>Conoced a los famosos y simpáticos pandas de Chengdú con este tour privado en español que también incluye un recorrido por otros significativos lugares de la ciudad.</p><p>Tras recogeros en vuestro hotel de Chengdú nos desplazaremos directamente hasta la famosa Reserva de Osos Panda, situada en las afueras de la ciudad.</p><p>Una vez en el interior de la reserva (entrada no incluida), daremos un paseo por este espacio natural en el que auténticos osos panda chinos juegan y comen bambú mientras disfrutan del entorno local. ¿Sabéis cuánto llega a pesar un ejemplar adulto? ¿Conocéis sus hábitos de vida? Descubriremos algunas curiosidades de estos simpáticos animales mientras visitamos la reserva.</p><p>Nuestra siguiente parada tendrá lugar en Jinli: la calle comercial más importante de Chengdú. Construida durante la etapa de la dinastía Qin (siglo III a.C), esta vía alberga diversos templos y construcciones tradicionales, así como también una amplia variedad de tiendas. En estos comercios encontraréis multitud de productos de la provincia de Sichuan como tés, alimentos, prendas de vestir…</p><p>Finalmente, desde la calle Jinli os llevaremos de vuelta hasta vuestro hotel de Chengdú.</p>"
42,23,Rías Baixas,La belleza de las Rías Baixas,425,6,,https://tourgalicia.es/wp-content/uploads/2018/10/que-hacer-en-ras-baixas.png,"<p> Islas paradisíacas, playas turquesa, delfines saltarines, castros milenarios, monumentos impresionantes, hórreos y muchísimo patrimonio. Hoy nos adentramos en uno de los puntos más turísticos de Galicia, vamos a descubrir los mejores lugares que ver en las Rías Baixas. Una ruta de una semana o más por las rías de Vigo, Pontevedra, Arousa y Muros-Noia ¡Casi nada!</p><p>Voy a tirar de refranero: «No son todos los que están ni están todos los que son». ¿Qué quiero decir? Que estamos ante una zona costera muy extensa y con un montón de atractivos naturales y patrimoniales. Hay lugares que no he destacado porque no me parecen tan imprescindibles y otros muchos que aún no conozco.</p><p>¡Más completo imposible! ¿Te vienes de viaje por las Rías Baixas?</p>"
