id,organizer_id,title,subtitle,price,duration,image,image_url,description
43,23,El Soplao,La maravillosa cueva de Cantabria,55,1,,https://fotos.hoteles.net/articulos/cueva-de-el-soplao-cantabria-5475-1.jpg,"<p>Era mi asignatura pendiente en Cantabria. Gran conocedora de la comunidad y aún no había tenido la oportunidad de descubrir un lugar imprescindible que ver en Cantabria, de adentrarme en las entrañas de esta maravillosa cueva. Un prodigio de la naturaleza que los expertos no dudan en catalogar como la Capilla Sixtina subterránea.</p><p>La Cueva de El Soplao da mucho de sí. Tanto para una visita convencional en la que conoceremos algunos de los puntos más impresionantes de la cavidad, como para los más aventureros.</p><p>Acompáname en esta aventura</p>"
44,23,Jaca y alrededores,Patrimonio románico y mucho más,390,3,,https://www.barcelo.com/guia-turismo/wp-content/uploads/2020/04/jaca.jpg,"<p>¿Aún no conoces uno de los pueblos más importantes del pirineo aragonés? Hoy te llevo a visitar Jaca y a descubrir un montón de planes increíbles en los alrededores, desde patrimonio románico hasta miradores y rutas de senderismo TOP.</p><p>Enclavado en un rincón privilegiado de la provincia de Huesca, en esa maravillosa transición entre la alta montaña y la sierra prepirenaica, Jaca nos da la bienvenida y nos abre un mundo de posibilidades. </p><p>Recomiendo mucho una estancia de un fin de semana para que os de tiempo a descubrir las maravillas que Huesca ofrece.</p>"
45,23,Lagunas de Neila,Paisajes de Burgos,70,1,,https://www.excursionesyrutasporcastillayleon.com/wp-content/uploads/2020/10/DSC_0506.jpg,"<p>¿Aún no conoces uno de los lugares más espectaculares de la provincia de Burgos?</p><p>Nos encontramos en el corazón de la Sierra de la Demanda. Una cadena montañosa que marca la orografía del sureste de la provincia de Burgos y nos deja pequeños tesoros de la naturaleza como las Lagunas de Neila. Un conjunto de lagunas de origen glaciar que rozan los 2.000 metros de altura y nos ofrecen uno de los paisajes montañosos más espectaculares de Burgos.</p><p>La montaña no entiende de límites territoriales.</p>"
46,23,Aigüestortes,Parc Nacional d’Aigüestortes,50,1,,https://i.pinimg.com/originals/af/82/97/af82977c0da55b8969972baab25367f5.jpg,"<p>¿Sueñas con perderte entre montañas, lagos, bosques y cascadas maravillosas? Pues no sueñes más y vente conmigo de viaje por el Parque Nacional d’Aigüestortes i Estany de Sant Maurici. Recorreremos los mejores senderos, carreteras panorámicas, pueblecitos increíbles, iglesias románicas y…muchísimo más.</p><p>Estamos ante el único parque nacional de Cataluña en el corazón de Los Pirineos a su paso por la provincia de Lleida. En concreto, vamos a recorrer la zona central del macizo pirenaico en busca de algunos de los paisajes de alta montaña más espectaculares del país. Aigüestortes se caracteriza por resguardar cientos de lagos entre picos que rozan los 3.000 metros de altura. Un auténtico paraíso para los amantes de la naturaleza y el senderismo.</p><p>¿Me acompañas a conocer las mejores rutas por Aigüestortes y Lago de San Mauricio?</p>"
47,23,Durmitor,Miradores de Montenegro,530,4,,https://dynamic-media-cdn.tripadvisor.com/media/photo-o/1a/65/8b/4f/caption.jpg?w=600&h=400&s=1,"<p> Si tuviese que quedarme con un sólo lugar del fascinante país de Montenegro lo tendría muy difícil. ¿La Bahía de Kotor o el Parque Nacional de Durmitor? ¿Tan impresionante es este parque nacional ubicado al norte del país como para compararlo con Kotor, la perla del Adriático?. Efectivamente, te lo confirmo. El Parque Nacional de Durmitor en Montenegro es un rincón de visita imprescindible, una de estas maravillas naturales que tenemos que hay que incluir en el itinerario por un país pequeño en tamaño y grande en posibilidades.</p><p>Como te puedes imaginar, el Parque Nacional de Durmitor ofrece una variedad de planes y actividades que hacer inmensa. Es muy difícil recorrerlo al completo en unos pocos días y, menos aún, si sólo dispones de una semana o dos para recorrer todo el país. Mi recomendación es que le dediques al menos un par de día completos.</p><p>No te arrepentirás</p>"
48,23,Budapest en 3 o 4 días,Monumentos gastronomía y mucho más,650,4,,https://static.eldiario.es/clip/04209c8a-3fca-4409-898f-222138452f96_16-9-discover-aspect-ratio_default_0.jpg,"<p>Lo digo con rotundidad. Budapest es una de las ciudades más bonitas del mundo. Lo mío con la capital de Hungría fue amor a primera vista. Ese primer paseo, el primer atardecer, la primera cerveza, el primer baño termal, el primer…. Cuando esperas algo bonito y te encuentras con algo espectacular la sensación es indescriptible. Hoy nos vamos a descubrir qué hacer y qué ver en Budapest en 3 o 4 días de la mano de una enamorada de la ciudad, una servidora.</p><p>Algunas de mis recomendaciones son un paseo por el Danubio, el Parlamento y las Colinas de Buda, pero Budapest ofrece mucho más.</p><p>Dale una oportunidad a esta maravilla de ciudad.</p>"
49,23,Polonia,Polonia en una semana,780,7,,https://viajes.nationalgeographic.com.es/medio/2018/12/12/breslavia-polonia_62172ffe_1500x952.jpg,"<p> Bueno, bonito y barato. No se me ocurre mejor definición de Polonia. Hoy os propongo una ruta por lo mejor que ver en Polonia en una semana en coche de alquiler por algunos de los puntos más espectaculares del país. Un circuito muy completo que incluye las ciudades de Varsovia, Poznan, Wroclaw, el campo de concentración Auschwitz-Birkenau y la preciosa e interesante Cracovia.</p><p>Es más que factible organizar una ruta por territorio polaco en autobús y en tren. Pero mi elección fue conducir un coche de alquiler, moverme a mi aire y no depender de ningún horario.</p><p>¿Se te ocurre un plan mejor?</p>"
50,23,Ruta por Escocia,Una semana en Highlands,750,7,,https://media.meer.com/attachments/6c0ef6ce446113956ec9d75075ccea62bbe192dc/store/fill/1230/692/4b6b32c3b39ddab6f474e040ed37f5daa185c54ff182f7407cf2d8135257/Escocia-Castillo-de-Eilean-Donan.jpg,"<p> Hay viajes con los que he soñado durante años. Realizar una ruta por Escocia y las Highlands fue por fin uno de esos sueños cumplidos. Había visto sus paisajes verdes tan característicos en un montón de películas y revistas de viajes, y yo quería estar allí. Nada mejor que organizar una ruta en coche de una semana por algunos de los puntos más importantes de esta región de Escocia.</p><p>Algunos de los puntos de tu travesía deben ser Edimburgo, Stirling, Fort William y la Isla de Skye. Lugares fascinantes que no te puedes perder!</p><p>Ah, y no te olvides de conducir por la izquierda!</p>"
51,23,El Chaltén,Rutas para montañeros,550,3,,https://static1.evcdn.net/images/reduction/1241671_w-1920_h-1080_q-70_m-crop.jpg,"<p> Y llegó El Chaltén, uno de los momentos más esperados de mi viaje por Patagonia. Con sus montañas de hielo, sus amaneceres de fuego, sus lagos de colores imposibles, sus paisajes a veces intimidantes, su buen ambiente y su belleza desmedida. En ese momento sentí que todo había merecido la pena, que el viaje por Argentina cobraba sentido. Y estás a punto de vivirlo en primera persona. </p><p> Nos encontramos en la provincia de Santa Cruz, en concreto dentro del Parque Nacional de los Glaciares. El Chaltén es en realidad un pequeño pueblo ubicado a los pies de una gran mole montañosa perteneciente a Los Andes australes con cumbres tan emblemáticas como el Fitz Roy o el Cerro Torre. </p><p>No esperes gran cosa del pueblo de El Chaltén. Sin embargo, debo reconocer que a mi me gustó muchísimo. En esta localidad se respira un ambiente muy especial. ¡Un ambiente montañero! Además, las construcciones son una monada. Las típicas casitas bajas hechas de madera y pintadas en tonos súper vivos. La mayoría son alojamientos o funcionan como comercios enfocados al viajero. Es decir, estamos ante un pueblo que se ha desarrollado en torno a su principal recurso económico, el turismo.</p><p>
Dentro de El Chaltén vas a encontrar todo lo necesario para subsistir durante tus días de estancia. Desde pequeños supermercados y multitud de bares y restaurantes, hasta agencias turísticas, tiendas con material deportivo y camping para comprar o alquilar, y algún puestecito con artesanía y recuerdos turísticos. Eso sí, prepárate para alucinar con los precios. Aún así, esta ha sido una de mis mejores experiencias y un imperativo cuando viajeis por Argentina.</p>"
